{
  "schema_version": 1,
  "tracker_sha256": "de3d669c60343a2560cc3647a0bc7043f666ebb67ea63638d48e99f19967a60a",
  "item_count": 101,
  "items": [
    {
      "id": "T0788",
      "line": 788,
      "mark": " ",
      "recommended_mark": "x",
      "section": "PeaceCraft3 \u2014 Tracker / M7 \u2014 Scripting (JASS + triggers) / `pcx-script` \u2014 raw-JASS syntax, resolution and interpreter foundation",
      "text": "**No interpreter by design** \u2014 no evaluation, no name/type resolution, no native dispatch, no `^^` code-tag substitution. A half-VM on a lossy tree is worse than no VM, because the loss is invisible and the result is *plausible but wrong*",
      "domain": "scripts",
      "disposition": "superseded_constraint",
      "false_open": true,
      "false_closed": false,
      "broad_gate": false,
      "acceptance_gate": "Retire the prohibition. Do not treat the interpreter as native-complete.",
      "owner_lane": "10-tracker",
      "next_slice": "Retire the prohibition. Do not treat the interpreter as native-complete.",
      "evidence": [
        {
          "kind": "source",
          "path": "crates/pcx-script/src/lib.rs",
          "note": "The crate exports eval, resolve, natives and value. The unchecked prohibition describes an older tree."
        }
      ],
      "order": 1,
      "depends_on": []
    },
    {
      "id": "T0985",
      "line": 985,
      "mark": " ",
      "recommended_mark": "x",
      "section": "PeaceCraft3 \u2014 Tracker / Multiplayer",
      "text": "Authoritative lockstep server owning the world",
      "domain": "multiplayer",
      "disposition": "false_open",
      "false_open": true,
      "false_closed": false,
      "broad_gate": false,
      "acceptance_gate": "Close only the movement-world server. Gameplay ownership stays on the simulation store.",
      "owner_lane": "unassigned:multiplayer",
      "next_slice": "Close only the movement-world server. Gameplay ownership stays on the simulation store.",
      "evidence": [
        {
          "kind": "source",
          "path": "crates/pcx-net/src/lib.rs",
          "note": "Server stores world, accepts input, and advances only when that tick's input is present. An earlier checkbox already records this server."
        }
      ],
      "order": 2,
      "depends_on": []
    },
    {
      "id": "T1133",
      "line": 1133,
      "mark": "!",
      "recommended_mark": "!",
      "section": "PeaceCraft3 \u2014 Tracker / Integration audit and performance",
      "text": "Original script execution fails closed on unsupported `GetPlayerNeutralPassive` during `common.j` initialization; original campaign completion and native behavior are not established. Opt-in selected-map adapters derive passive/aggressive and first-family `GetBJMaxPlayers`/`GetBJPlayerNeutralVictim`/`GetBJPlayerNeutralExtra`/ `GetBJMaxPlayerSlots` rules from independently approved local executable profiles and the admitted W3I. The same Human01 Program/localization gate composes 43 source-selected symbolic contracts, retains 432 typed identities. Explicit shared-arena timer/group admission now completes all Human01 globals (four timers and three groups) and enters authored `config`. Executed config now retains five metadata fields and five start locations. Source-bounded shared-arena players retain five player identities and 35 authored field assignments. Bounded authored priority relationships now let Human01 `config` complete; the same VM enters `main` and uses source-bound camera margins to retain authored camera bounds before selecting explicitly bound day/night source models, then reaching a source-qualified immutable startup time-of-day snapshot, then requesting both source-backed ambient sounds. An explicit bounded start queue retains the authored night sound request. Source-bounded map-music selection now retains the executed name/random/index. Exact direct-file PCM admission now creates the first authored voice object. Selected source-label parameters now bind to that same sound identity while preserving its PCM/creation inputs, and explicit executed duration state now retains the authored integer on that same identity. The next `CreateSound` lacks its caller-provided file binding. Raw table flags remain separate from effective settings. Explicit parameter collections now retain each assigned table/row/source, reject cross-table label ambiguity and preserve a separate dialogue schema without fabricating the absent full-profile fields. A bounded PCM decoder view preserves source receipts and exact samples while placing fmt/data chunks before opaque ancillary chunks for the installed WAV decoder. The snapshot does not advance time or replace a running game clock, and queued audio/music selection is not yet consumed by a playback backend. All 305 play tests pass with five explicit ignores; strict native/WASM Clippy, WASM generation and actual 32-bit lifecycle/config/player/priority/camera/model/clock/sound checks pass. These are bounded Host/data checks, not campaign or native gameplay proof. Launcher profile loading/default Host wiring and other player natives remain open; see `selected-map-neutral-host.md`, `playercolor-host.md` and `script-timer-arena.md`/`script-group-arena.md`/`script-map-config.md`/ `script-player-setup.md`/`script-start-priorities.md`/`script-camera-input.md`/ `script-day-night-models.md`/`script-label-sounds.md`/`script-startup-clock.md`/ `script-map-music-selection.md`/`script-file-sounds.md`/`script-sound-parameters.md`/ `script-sound-parameter-banks.md`/`script-pcm-decoder.md`.",
      "domain": "campaign",
      "disposition": "blocker_advanced",
      "false_open": false,
      "false_closed": false,
      "broad_gate": false,
      "acceptance_gate": "The named neutral getter is no longer the current stop. Continue from the missing CreateSound file binding without calling the campaign complete.",
      "owner_lane": "01-campaign",
      "next_slice": "The named neutral getter is no longer the current stop. Continue from the missing CreateSound file binding without calling the campaign complete.",
      "evidence": [
        {
          "kind": "source",
          "path": "crates/pcx-play/src/neutral_player.rs",
          "note": "Passive and aggressive neutral adapters exist. The same checkbox says the next CreateSound lacks its file binding and that campaign completion is not established."
        }
      ],
      "order": 3,
      "depends_on": [
        "T0849",
        "T0632"
      ]
    },
    {
      "id": "T0849",
      "line": 849,
      "mark": "~",
      "recommended_mark": "~",
      "section": "PeaceCraft3 \u2014 Tracker / M7 \u2014 Scripting (JASS + triggers) / What M7 still is",
      "text": "JASS resolver, typed values, interpreter and caller-owned Host exist. Native handle behavior/casts and the game Host remain incomplete.",
      "domain": "scripts",
      "disposition": "accurate_partial",
      "false_open": false,
      "false_closed": false,
      "broad_gate": false,
      "acceptance_gate": "Extend the caller-owned host one missing native at a time.",
      "owner_lane": "01-campaign",
      "next_slice": "Extend the caller-owned host one missing native at a time.",
      "evidence": [
        {
          "kind": "source",
          "path": "crates/pcx-script/src/eval.rs",
          "note": "Evaluation exists. The checkbox keeps native handle behavior incomplete."
        }
      ],
      "order": 4,
      "depends_on": [
        "T0788"
      ]
    },
    {
      "id": "T0862",
      "line": 862,
      "mark": " ",
      "recommended_mark": "~",
      "section": "PeaceCraft3 \u2014 Tracker / M7 \u2014 Scripting (JASS + triggers) / What M7 still is",
      "text": "Native function table (exact signatures, return conventions and **side-effect ordering** from `game.dll`)",
      "domain": "scripts",
      "disposition": "partial_unmarked",
      "false_open": false,
      "false_closed": false,
      "broad_gate": false,
      "acceptance_gate": "Add measured natives with source diagnostics. Do not fill the table with zero returns.",
      "owner_lane": "01-campaign",
      "next_slice": "Add measured natives with source diagnostics. Do not fill the table with zero returns.",
      "evidence": [
        {
          "kind": "source",
          "path": "crates/pcx-play/src/object_host.rs",
          "note": "A bounded host dispatches selected natives such as CreateTimer. It is not a game.dll signature table."
        }
      ],
      "order": 5,
      "depends_on": [
        "T0849"
      ]
    },
    {
      "id": "T0852",
      "line": 852,
      "mark": "~",
      "recommended_mark": "~",
      "section": "PeaceCraft3 \u2014 Tracker / M7 \u2014 Scripting (JASS + triggers) / What M7 still is",
      "text": "`WCT` custom-text compilation: the public bounded adapter joins checked zero-header WCT/v4 WTG bodies with caller-supplied context and preludes, preserves cross-block state, source diagnostics and WTS lookup. Synthetic VM tests and the identified local Human06 compilation gate pass. Native source/load/initializer ordering, GUI lowering and campaign execution are still open; see `docs/re-notes/wct-compilation.md`. Complete WCT framing is now checked before materialization; malformed allocation probes and eight actual WASM parser groups pass. The explicit local NightElf06 authored-context compile gate passes; chapter execution remains open. See `docs/re-notes/wct-framing-preflight.md`.",
      "domain": "scripts",
      "disposition": "accurate_partial",
      "false_open": false,
      "false_closed": false,
      "broad_gate": false,
      "acceptance_gate": "Chapter execution remains open after the Human06 and NightElf06 compile gates.",
      "owner_lane": "01-campaign",
      "next_slice": "Chapter execution remains open after the Human06 and NightElf06 compile gates.",
      "evidence": [
        {
          "kind": "source",